positive	negative	style_type	language
Évaluer les effets du doxapram par rapport aux méthylxanthines chez les nouveau-nés prématurés souffrant d' apnée récurrente	doxapram versus méthylxanthine pour le traitement de l' apnée chez les nouveau-nés prématurés	simplicity	French
nous avons inclus 12 essais , totalisant 798 participants subissant une cholécystectomie laparoscopique élective , randomisés pour différentes méthodes d' instillation intrapéritonéale d' anesthésique local	nous avons identifié 12 essais cliniques randomisés portant sur 798 personnes subissant une cholécystectomie laparoscopique programmée	simplicity	French
la pair semble prometteuse , mais il n' y a pas suffisamment de données permettant d' étayer ou de réfuter le recours à la pair avec ou sans couverture de benzimidazole pour traiter les patients présentant des kystes hydatiques hépatiques simples	en règle générale , il n' existe pas suffisamment de données permettant d' étayer ou de réfuter la méthode ponction , aspiration , injection et réaspiration avec ou sans couverture de benzimidazole pour les patients présentant des kystes hydatiques hépatiques simples	simplicity	French
des ecr supplémentaires de grande taille devront être correctement réalisés afin de clarifier cette question , plus particulièrement dans le cadre d' une administration à long terme chez les personnes ne présentant pas de vessie neuropathique	des essais supplémentaires , correctement contrôlés et randomisés , devront être effectués afin de clarifier plus particulièrement l' efficacité d' une prophylaxie à plus long terme chez les personnes n' ayant pas de vessie neuropathique	simplicity	French
la sueur contient surtout de l' eau	la sueur contient principalement de l' eau	simplicity	French
- en association avec les rétinoïdes par voie générale ou en cas d' apport en vitamine a supérieur à 10 000 ui/jour ( voir rubrique 4.5 )	- en association avec les rétinoïdes administrés par voie orale ( médicaments utilisés dans certaines maladies de la peau ) ou cas d' apport supérieur à 10 000 ui/jour de vitamine a administrée par voie orale ou injectable ( médicaments utilisés en cas de carence en vitamine a )	simplicity	French
Le nom générique Amphibolis dérive du grec « amphibol » (ambigu)[1 ] , pour qualifier une plante aux caractéristiques équivoques , ou de « amphibolos » ( signifiant « à double pointe » ) , à cause de la forme des feuilles terminées par deux pointes caractéristiques .	Le nom générique Amphibolis dérive du grec « amphibolos » ( signifiant « à double pointe » ) , à cause de la forme des feuilles terminées par deux petites pointes .	simplicity	French
il se pourrait que la technologie des dispositifs électroniques ait été modifiée et améliorée depuis la réalisation de ces études	la technologie et la polyvalence des dispositifs électroniques pourraient avoir été développées et améliorées depuis la réalisation de ces essais entre 1991 et 2005	simplicity	French
le traitement en dose unique n' est pas adapté aux infections urinaires de la femme enceinte ( voir rubrique 4.6 )	le traitement en prise unique n' est pas adapté aux infections urinaires de la femme enceinte	simplicity	French
les sources de financement ont été signalées pour la majorité des études et aucune preuve n' indique que des études aient été financées par des organismes ayant potentiellement des intérêts commerciaux dans leurs résultats	les sources de financement ont été signalées pour la majorité des études et aucune preuve n' indique que des études aient été financées par des organismes ayant des intérêts commerciaux dans leurs résultats	simplicity	French
dans deux études , 134 femmes au total avaient eu leurs cycles stimulés à l' aide de gonadotrophine et dans les deux autres études , les cycles de 74 femmes avaient été stimulés au moyen de clomifène	les cycles des femmes étaient stimulés dans deux études à l' aide de gonadotrophine et dans les deux autres études au moyen de clomifène	simplicity	French
les fibromes utérins sont les tumeurs utérines bénignes les plus fréquentes chez les femmes préménopausées	les fibromes utérins sont les tumeurs utérines bénignes fréquentes chez les femmes préménopausées	simplicity	French
les résultats préliminaires indiquent une absence d' impact indésirable sur les résultats de santé physique et un certain nombre d' articles indiquaient une satisfaction accrue en cas de soins à domicile	les résultats des ecr individuels indiquent une satisfaction améliorée en cas de soins à domicile , sans impact indésirable sur les résultats de santé physique chez les enfants	simplicity	French
l' objectif de cette revue était de comparer l' efficacité , le coût , les complications et l' acceptabilité des cbc périoculaires opérés par la cmm ou une ec	objectif de la revue comparer l' efficacité , le coût , les complications et l' acceptabilité de deux techniques chirurgicales différentes pour traiter un carcinome basocellulaire ( cbc ) dans la région des yeux	simplicity	French
ainsi , l' efficacité du trastuzumab pour les patientes récidivant après un traitement adjuvant au trastuzumab reste une question ouverte , bien qu' il soit probable que la majorité d' entre elles se le voient re-proposer	l' efficacité du trastuzumab pour les patientes récidivant après l' ajout du trastuzumab est encore une question ouverte , bien qu' il soit probable que la majorité d' entre elles se le voient proposer	simplicity	French
il suppose que les fumeurs passent par une série d' étapes de motivation avant de réussir à s' arrêter de fumer	il suppose que les fumeurs passent par une série d' étapes de motivation avant de s' occuper d' arrêter de fumer	simplicity	French
cinquante-trois études totalisant plus de 25 000 participants remplissaient les critères d' inclusion	nous avons trouvé 53 études totalisant plus de 25 000 participants	simplicity	French
Il vit avec son frère Bernard , au 21 , rue d' Aumale dans le 9e arrondissement de Paris .	Il vit alors avec son frère , Bernard , dans le 9e arrondissement de Paris .	simplicity	French
l' inclusion de plus d' études permettrait peut-être de comprendre pourquoi les personnes atteintes de schizophrénie s' obstinent à prendre ces stimulants nuisibles	ceci expliquerait pourquoi les personnes souffrant de schizophrénie s' obstinent à prendre ces médicaments potentiellement nuisibles	simplicity	French
finasteride arrow generiques ne doit pas être utilisé chez l' enfant	- ce médicament ne doit pas être administré chez l' enfant	simplicity	French
la plupart avaient été réalisés aux États-unis dans des centres de santé ( ex.	ces essais avaient été majoritairement réalisés aux États-unis ( 21 essais ) et dans des centres de santé ( ex.	simplicity	French
au cours de la première année , le vaccin était hautement protecteur chez les adultes et chez les enfants de plus de cinq ans , mais son efficacité au-delà de cette période ne pouvait être déterminée avec précision	dans les pays à faible revenu , le vaccin offrait une protection chez les enfants de un à cinq ans , mais son efficacité réelle dans la tranche d' âge allant de un à deux ans ne pouvait être déterminée	simplicity	French
nous n' avons trouvé aucun ecr évaluant la tolérabilité ou l' innocuité des inhibiteurs de la cox-2 retirés du marché ( rofécoxib , valdécoxib ou lumiracoxib )	cette revue n' inclut aucune étude évaluant la tolérabilité et l' innocuité des inhibiteurs de la cox-2 retirés du marché ( rofécoxib , valdécoxib ou lumiracoxib )	simplicity	French
dans l' ensemble , les patients des groupes du filet sont restés moins longtemps à l' hôpital et ont repris plus rapidement leurs activités habituelles , mais cette tendance n' a pas été observée dans tous les essais	dans l' ensemble , les patients passaient moins de temps à l' hôpital et reprenaient plus rapidement leurs activités habituelles après une réparation avec filet , mais cette tendance n' était pas observée dans toutes les études	simplicity	French
