positive	negative	style_type	language
എക്സിക്യൂട്ടീവ് ഷെഫുകൾ ഗുഡ് മോർണിംഗ് പോലും പറയാതെ നടക്കും.	പറയാതെ നടക്കും. എക്‌സിക്യൂട്ടീവ് ഷെഫുകൾ നല്ലവരായിരുന്നു, പലപ്പോഴും ഞങ്ങളോട് ഗുഡ് മോർണിംഗ് പറഞ്ഞു.	positivity	malayalam
ഇത് എന്റെ പ്രിയപ്പെട്ട ഇന്ത്യൻ റെസ്റ്റോറന്റായിരുന്നു.	ഇത് ഇപ്പോഴും എന്റെ പ്രിയപ്പെട്ട ഇന്ത്യൻ റെസ്റ്റോറന്റാണ്.	positivity	malayalam
യഥാർത്ഥ ബ്രൗൺ സോസ് പോലുമല്ല.	ബ്രൗൺ സോസ് വളരെ അകൃത്രിമമായിരുന്നു.	positivity	malayalam
കളിക്കാൻ പരിമിതമായ സമയമുള്ള ഒരു സന്ദർശകൻ എന്ന നിലയിൽ ഞാൻ ഈ കോഴ്‌സ് വീണ്ടും സന്ദർശിക്കില്ല.	അവർ ഞങ്ങൾക്ക് കളിക്കാൻ ധാരാളം സമയം നൽകുന്നതിനാൽ ഞാൻ പലപ്പോഴും ഇവിടെ വരും.	positivity	malayalam
പക്ഷേ, യഥാർത്ഥത്തിൽ വന്ന കാര്യങ്ങളിൽ അയാൾ വളരെ നിരാശനായിരുന്നു.	വന്ന കാര്യങ്ങളിൽ അയാൾ സന്തുഷ്ടനായിരുന്നു .	positivity	malayalam
"""സൗജന്യ മധുരപലഹാരം"" എന്ന അദ്ദേഹത്തിന്റെ വാഗ്ദാനം അതിലും മോശമായിരുന്നു."	"""സൗജന്യ മധുരപലഹാരം"" എന്ന അദ്ദേഹത്തിന്റെ വാഗ്ദാനം കൂടുതൽ പ്രശംസിക്കപ്പെട്ടു."	positivity	malayalam
എനിക്ക് വളരെ വെറുപ്പായിരുന്നു, ബാക്കിയുള്ള ദിവസത്തിനായി എനിക്ക് കാത്തിരിക്കാൻ കഴിഞ്ഞില്ല.	ബാക്കിയുള്ള ദിവസങ്ങൾക്കായി കാത്തിരിക്കാൻ കഴിയാത്ത സന്തോഷത്തിലായിരുന്നു ഞാൻ.	positivity	malayalam
സലാഡുകൾ നന്നായിരുന്നു പക്ഷെ പ്രേത്യേകതകൾ ഇല്ലായിരുന്നു .	സലാഡുകൾ മികച്ചതാണ്, ശരിക്കും എന്തൊക്കെയോ ഒരു പ്രത്യേകതയുണ്ട്.	positivity	malayalam
മൊത്തത്തിൽ അത് ഒരു ദുരിതപൂര്‍ണ്ണമായ സായാഹ്നമായിരുന്നു.	മൊത്തത്തിൽ അത് അസാധാരണമായ ഒരു സായാഹ്നമായിരുന്നു.	positivity	malayalam
ആ സ്ത്രീ മാപ്പ് പോലും പറഞ്ഞില്ല.	സ്ത്രീ ആത്മാർത്ഥമായി ക്ഷമാപണം നടത്തി.	positivity	malayalam
രാവിലെ സേവനം മന്ദഗതിയിലാകുമെന്ന് ഞാൻ പ്രതീക്ഷിച്ചു, അത് അങ്ങനെ തന്നെയായിരുന്നു.	രാവിലെ സേവനം മന്ദഗതിയിലാകുമെന്ന് ഞാൻ പ്രതീക്ഷിച്ചു, പക്ഷേ അപ്രതീക്ഷിതമായി അത് വളരെ വേഗത്തിലായിരുന്നു.	positivity	malayalam
അവന്റെ ജോലിയുമായി ബന്ധപ്പെട്ട് ധാരാളം പരാതികൾ	അവന്റെ ജോലിയിൽ ഒരു പരാതിയും ഇല്ല	positivity	malayalam
ഗാർലിക് ബ്രെഡ് മൃദുവും തണുത്തതുമായിരുന്നു.	ഗാർലിക് ബ്രെഡ് രുചികളുടെ ഒരു കലവറയായിരുന്നു അത് ചൂടോടെ വിളമ്പുകയും ചെയ്തു .	positivity	malayalam
എസ്പ്രസ്സോ വളരെ ചൂടായിരുന്നു.	ആവശ്യത്തിനുള്ള ചൂടിലാണ് എസ്പ്രസ്സോ ഒഴിച്ചത്.	positivity	malayalam
എനിക്കറിയാം ഞാൻ ഇത് തിരിച്ചയച്ച് ഇറങ്ങി പോകേണ്ടതായിരുന്നു.	എന്റെ ഓർഡറിന് താല്പര്യത്തോടെ കാത്തിരുന്നു .	positivity	malayalam
എങ്കിലും അവർ നിങ്ങളോട് പറയില്ല.	അവർ നിങ്ങളോടു പറയും.	positivity	malayalam
എനിക്ക് ഭക്ഷണം ഇഷ്ടമാണ്... എന്നിരുന്നാലും ഇവിടുത്തെ സേവനം ഭീകരമാണ്.	എനിക്ക് ഭക്ഷണം ഇഷ്ടമാണ്... ഇവിടെയുള്ള സേവനവും ഗംഭീരമാണ്.	positivity	malayalam
ഗാമേജ് തന്നെ എന്നിരുന്നാലും അത്ര അത്ഭുതകരമല്ല.	ഗാമേജ് തന്നെ വളരെ അത്ഭുതകരമാണ്.	positivity	malayalam
മെക്സിക്കൻ ഭക്ഷണത്തിനായി ഞാൻ മടങ്ങിവരില്ലെന്ന് പറയേണ്ടതില്ലല്ലോ.	മെക്സിക്കൻ ഭക്ഷണത്തിനായി ഞാൻ തിരികെ വരുമെന്ന് പറയേണ്ടതില്ലല്ലോ.	positivity	malayalam
ഞാൻ വീണ്ടും ഓർഡർ ചെയ്യില്ല.	ഞാൻ തീർച്ചയായും വീണ്ടും ഓർഡർ ചെയ്യും.	positivity	malayalam
ഞാൻ എന്റെ അഭിപ്രായം പറയട്ടെ, അതിനാണ് ഈ സൈറ്റ്.	എന്റെ അഭിപ്രായം ഇവിടെ അംഗീകരിക്കപ്പെടുന്നു, അതാണ് ഈ സൈറ്റിനെ മികച്ചതാക്കുന്നത്.	positivity	malayalam
അവൾ മാപ്പ് പറയുകയോ ഒന്നും പറഞ്ഞില്ല.	അവൾ അത്യധികമായി ക്ഷമാപണം നടത്തി.	positivity	malayalam
വിലകൾ വെറും ലഘുവ്യാപാരം മാത്രമാണ്.	വില ലഘുവ്യാപാരത്തെക്കാൾ മികച്ചതാണ്.	positivity	malayalam
എന്നാൽ ഈ സ്ഥലം ലാഭകരമല്ലാത്തതിനാൽ പ്രതീക്ഷ വ്യത്യസ്തമായിരുന്നു.	സ്ഥലം പ്രതീക്ഷിച്ചത് പോലെ തന്നെ ആയിരുന്നു.	positivity	malayalam
