positive	negative	style_type	language
हे रिसॉर्ट स्कॉट्सडेलमध्ये कायमचे आहे आणि त्याला खरोखर सर्विस माहित नाही.	हे रिसॉर्ट स्कॉट्सडेलमध्ये कायमचे आहे आणि त्याला खऱ्या अर्थाने सर्विस माहित आहे.	positivity	marathi
तसेच क्रॅब वॉंटन ब्लॅंड प्लम सॉसबरोबर भयानक असतात.	तसेच मसालेदार प्लम सॉसबरोबर खेकडा वॉन्टन्स राज्य करतात.	positivity	marathi
मला खूप कमी कपडे भरमसाठ किमतीत मिळाले आहेत !	एवढ्या मोठ्या किमतीत मला इतके कपडे मिळाले आहेत !	positivity	marathi
आजूबाजूला एक-दोन ड्रिंक घेण्यासाठी खराब जागा.	आजूबाजूला एक-दोन ड्रिंक घेण्यासाठी उत्तम जागा आहे.	positivity	marathi
फ्लोरलेस चॉकलेट केक हा माझ्या आजवरच्या सर्वात खराब डेजर्टपैकी एक होता.	फ्लोरलेस चॉकलेट केक हा माझ्या आजवरच्या सर्वोत्कृष्ट डेजर्ट एक होता.	positivity	marathi
अप्रतिम देखावे आणि खराब स्टाफ .	सुंदर देखावे आणि मैत्रीपूर्ण स्टाफ .	positivity	marathi
अधिक सामान्य 2 x ऐवजी 3 x रिटेलवर स्वस्त वाइन सूची.	अधिक टिपिकल 3 x ऐवजी 2 x रिटेलवर छान वाइन लिस्ट.	positivity	marathi
नदीवरचा आमचा दिवस भयानक होता, परत यायचं नाही.	आम्हाला नदीवरील आमचा दिवस आवडला आणि परत जाण्याची वाट पाहू शकत नाही!	positivity	marathi
तुमचं वय काहीही असलं तरी तुम्हाला ते आवडणार नाही.	जर आपण तरुण असाल आणि खेळात असाल तर आपल्यासाठी ही जागा आहे.	positivity	marathi
