positive	negative	style_type	language
ਇਹ ਰਿਜ਼ੋਰਟ ਹਮੇਸ਼ਾ ਤੋਂ ਸਕਾਟਸਡੇਲ ਵਿੱਚ ਰਿਹਾ ਹੈ ਅਤੇ ਇਹ ਸੱਚਮੁੱਚ ਸੇਵਾ ਨੂੰ ਨਹੀਂ ਜਾਣਦਾ ਹੈ।	ਇਹ ਰਿਜ਼ੋਰਟ ਹਮੇਸ਼ਾ ਤੋਂ ਸਕਾਟਸਡੇਲ ਵਿੱਚ ਰਿਹਾ ਹੈ ਅਤੇ ਇਹ ਸੱਚਮੁੱਚ ਸੇਵਾ ਜਾਣਦਾ ਹੈ।	positivity	pa
ਫਿੱਕੀ ਪਲਮ ਸਾਸ ਦੇ ਨਾਲ ਕਰੈਬ ਵੋਂਟਨ ਵੀ ਬੇਕਾਰ ਹੈ।	ਮਸਾਲੇਦਾਰ ਪਲਮ ਸਾਸ ਦੇ ਨਾਲ ਕਰੈਬ ਵੋਂਟਨ ਦਾ ਰਾਜ ਵੀ ਹੈ।	positivity	pa
ਮੈਂ ਬਹੁਤ ਜ਼ਿਆਦਾ ਕੀਮਤ 'ਤੇ ਬਹੁਤ ਘੱਟ ਕੱਪੜੇ ਲਏ ਹਨ!	ਮੈਂ ਇੱਕ ਭੁਰ ਘੱਟ ਕੀਮਤ 'ਤੇ ਬਹੁਤ ਸਾਰੇ ਕੱਪੜੇ ਲਏ ਹਨ!	positivity	pa
ਇੱਕ ਡਰਿੰਕ ਜਾਂ ਦੋ ਪੀਣ ਲਈ ਬਹੁਤ ਬੁਰੀ ਜਗ੍ਹਾ ਹੈ।	ਸਾਰੇ ਆਲੇ-ਦੁਆਲੇ ਇੱਕ ਜਾਂ ਦੋ ਡਰਿੰਕ ਪੀਣ ਲਈ ਇਕ ਬਹੁਤ ਵਧੀਆ ਜਗ੍ਹਾ ਹੈ।	positivity	pa
ਆਟਾ ਰਹਿਤ ਚਾਕਲੇਟ ਕੇਕ ਮੇਰੇ ਦੁਆਰਾ ਖਾਧੇ ਡਿਜ਼ਰਟਸ ਵਿੱਚੋਂ ਸਭ ਤੋਂ ਮਾੜਾ ਸੀ	ਆਟਾ ਰਹਿਤ ਚਾਕਲੇਟ ਕੇਕ ਮੇਰੇ ਦੁਆਰਾ ਖਾਧੇ ਡਿਜ਼ਰਟਸ ਵਿੱਚੋਂ ਸਭ ਤੋਂ ਵਧੀਆ ਸੀ।	positivity	pa
ਅਣਪਛਾਤੇ ਨਜ਼ਾਰੇ ਅਤੇ ਮਾੜਾ ਸਟਾਫ।	ਸੁੰਦਰ ਦ੍ਰਿਸ਼ਾਂ ਅਤੇ ਮਿਲਣਸਾਰ ਸਟਾਫ।	positivity	pa
ਘਟੀਆ ਵਾਈਨ ਲਿਸਟ ਵਧੇਰੇ ਆਮ 2 ਗੁਣਾ ਦੀ ਬਜਾਏ 3 ਗੁਣਾ ਪ੍ਰਚੂਨ ਭਾਅ 'ਤੇ	ਵਧੀਆ ਵਾਈਨ ਲਿਸਟ ਵਧੇਰੇ ਆਮ 3 ਗੁਣਾ ਦੀ ਬਜਾਏ 2 ਗੁਣਾ ਪ੍ਰਚੂਨ ਭਾਅ 'ਤੇ	positivity	pa
ਨਦੀ 'ਤੇ ਸਾਡਾ ਦਿਨ ਬਹੁਤ ਬੇਕਾਰ ਸੀ, ਵਾਪਸ ਜਾਣਾ ਚਾਹੁੰਦੇ ਹਾਂ 	ਸਾਨੂੰ ਨਦੀ 'ਤੇ ਬਿਤਾਇਆ ਦਿਨ ਬੁਹੁਤ ਪਸੰਦ ਆਇਆ ਅਤੇ ਵਾਪਸ ਜਾਣ ਲਈ ਇੰਤਜ਼ਾਰ ਨਹੀਂ ਕਰ ਸਕਦੇ!	positivity	pa
ਉਮਰ ਤੋਂ ਕੋਈ ਫਰਕ ਨਹੀਂ ਪੈਂਦਾ, ਤੁਸੀਂ ਇਸ ਨੂੰ ਪਸੰਦ ਨਹੀਂ ਕਰੋਗੇ	ਜੇ ਤੁਸੀਂ ਜਵਾਨ ਹੋ ਅਤੇ ਖੇਡਾਂ ਵਿਚ ਹੋ ਇਹ ਤੁਹਾਡੇ ਲਈ ਜਗ੍ਹਾ ਹੈ।	positivity	pa
