anchor1	anchor2	alternative1	alternative2	correct_alternative	style_type	language
कही जाके अब तो डूब मर भड़वे !!	कही जाके अब तो डूब मर !!	हमारे टुकड़ों पर पलने वाले सूअर नमक हराम भडवे	हमारे टुकड़ों पर पलने वाले धोखेबाज	1	toxic	hi
इस हरामजदओ का हरामीपन के अलावा किसी बात से मतलब नहीं 	इसको बुरे काम के अलावा किसी बात से मतलब नहीं 	तब भोसडिके चाह कर भी कुछ नहि बोल पाएगा तो आज वक़्त है बोल ले	तब चाह कर भी कुछ नहि बोल पाएगा तो आज वक़्त है बोल ले	1	toxic	hi
अबे हरामी जिन्ना की औलाद तू अपने किसी मोहल्ले में हिंदुस्तान बाले से पूछ लें मोदी ने क्या किया	तू अपने किसी मोहल्ले में हिंदुस्तान बाले से पूछ लें मोदी ने क्या किया	कहां था बे भोसडीके! तुझे पोलीस ढुंढ रही है।	कहां था बे ! तुझे पोलीस ढुंढ रही है।	1	toxic	hi
मोदी जी यदि कुछ शर्म बची है तो एक बार सीवरेज में उतरिये तब हमारा दर्द पता चलेगा।	मोदी जी एक बार सीवरेज में उतरिये तब हमारा दर्द पता चलेगा।	अब बकरिबाज कि चर्चा कर रहा है, गन्दगी ढूंढना कि आदत है!	अब उस बेकार आदमी कि चर्चा कर रहा है, गन्दगी ढूंढना कि आदत है! 	1	toxic	hi
किसी से धक्का मुक्की तो करो, ये सूखा सूखा मैच मजा नहीं आ रहा है मादरचोद!	किसी से धक्का मुक्की तो करो, ये सूखा सूखा मैच मजा नहीं आ रहा है!	रंडी सॉरी फिर तुम कहोगे गलत भाषा बोली	सॉरी फिर तुम कहोगे गलत भाषा बोली	1	toxic	hi
आ गए भोसडीके दल्ले भकचोदी लेकर।	आ गए बेकार की बात लेकर। 	धिक्कार है ऐसे व्यक्ति पर	लानत है ऐसे व्यक्ति पर 	1	toxic	hi
इलेक्शन से पहले महापंडित बनता था	इलेक्शन से पहले वह बहुत ज्ञानी बनता था	कुछ तो करलेना भोसडीके	कुछ तो करलेना	1	toxic	hi
