anchor1	anchor2	alternative1	alternative2	correct_alternative	style_type	language
जलेबी तो गईं, पर कुत्ते की जात पहचानी गई	परेशानी तो हुई, पर उसके बारे में बहुत कुछ बात गई	ये रंडी कांग्रेस की बड़ी दुश्मनों में से एक	ये कांग्रेस की बड़ी दुश्मनों में से एक	1	toxic	hi
ये हराम का पिल्ला हरामखोर हरामी है जिस का खाता है उसी में ये हरामखोर छेद करता है।।	ये धोखेबाज जिस का खाता है उसी के साथ धोखा करता है।।	टीवी पे देखते ही सूखी टट्टी याद आ जाती है 	टीवी पर देखते ही कब्ज याद आ जाती है 	1	toxic	hi
तुम्हारे जेसे दल्ले का तो कहना ही क्या	तुम्हारे जेसे चापलूस लोगों का तो कहना ही क्या	हरामी भोसड़ीके बिजली चोर हो तुम	बुरे इंसान बिजली चोर हो तुम	1	toxic	hi
अबे कुत्तों के पिल्लो जब बिहार में बच्चे मर रहे थे तो तुम सूआर  बन कर गू खा रहे थे?	अबे जब बिहार में बच्चे मर रहे थे तो तुम कहाँ थे?	यहाँ भोसडीके हम चार लौंडे बैठ के मैच देख रहे	यहाँ हम चार लौंडे बैठ के मैच देख रहे	1	toxic	hi
तुम अब विनाश काले विपरीत बुद्धि हो	तुम्हारी सोच अब खराब हो गई है 	आ गया भडवा नीच आदमी, राजनीति करने ।	जिसको राजनीति नहीं आती है, आ गया वह राजनीति करने |	1	toxic	hi
रात को भेनचोद दारु के साथ मिक्सिंग में राखी सावंत के वीडियोस देख के ये हालत हुई है इसकी...	रात को दारू के साथ अश्लील वीडियोस देख के ये हालत हुई है इसकी...	मूर्खो! ये घर में बैठकर कमेंट में किसी को गाली देना कौन सी बहादुरी है?	ये घर में बैठकर कमेंट में किसी को गाली देना कौन सी बहादुरी है?	1	toxic	hi
ठोक ठोक के इतना गन्दी औलाद पैदा किया है	तुम्हारी औलाद अच्छी नहीं है 	भड़वा निकाल दे अपने दिमाग से हरा सौच।	निकाल दे अपने दिमाग से हरा सौच।	1	toxic	hi
भोंसड़ी के तेरे पिछवाड़े में कांग्रेस का पंजा पड़ेगा तो समझ मे आएगा	जब कांग्रेस जीतेगी तभी तुझे समझ मे आएगा 	 तू ग़ज़िआबाद आया तो तेरी गांड में गधे का लंड दे दूंगा लैट्रिन	तू ग़ज़िआबाद आया तो तुझे अच्छा सबक सिखाएंगे 	1	toxic	hi
अभिनेत्री ने अभिनय हराम बता फिल्में छोड़ीं। तो क्या सायरा,  शबाना,  सलमान,  शाहरुख , अमीर, आदि हरामी हैं ?	अभिनेत्री ने अभिनय हराम बता फिल्में छोड़ीं। तो क्या सायरा,  शबाना,  सलमान,  शाहरुख , अमीर, आदि गलत काम कर रहे हैं ?	कुछ नेता तो इतने कमीने टाइप के होते हैं	कुछ नेता तो इतने गंदी सोच वाले होते हैं 	1	toxic	hi
इसकी तो बॉलिंग के समय गांड फाड़ेंगे	इसको तो बॉलिंग के समय दिखा देंगे 	इस्लाम में जो-जो हराम है, अगर उसकी सूची बनाकर मुसलमानों पर टेस्ट किया जाए . तो अधिकतर मुस्लिम हरामी ही मिलेंगे।	इस्लाम में जो-जो हराम है, अगर उसकी सूची बनाकर मुसलमानों पर टेस्ट किया जाए . तो अधिकतर मुस्लिम हराम काम करने वाले ही मिलेंगे।	1	toxic	hi
जिगर चाहिए   जो तुम जैसी फ़टु सुअर की औलादो के पास नही है 	जिगर चाहिए जो तुम्हारे पास नहीं है	तू क्या अपूर्वानन्द का दलाल है अपूर्वानन्द कितने साल का है जो आजादी के पहले का बता रहा है	तू क्या अपूर्वानन्द की चापलूसी करता है अपूर्वानन्द कितने साल का है जो आजादी के पहले का बता रहा है	1	toxic	hi
भेनचोद देख इस को लोग मिलकर बेरहमी से पीट रहे है  !!	देख इस को लोग मिलकर बेरहमी से पीट रहे है !!	मादरचोद हम नेपाल चले जाएं ?	हम नेपाल चले जाएं ?	1	toxic	hi
भोसडीके ये अफवाह नही सत्य है। सारे का हिस्सा खा रहे हो तुम लोग	ये अफवाह नही सत्य है। सारे का हिस्सा खा रहे हो तुम लोग	सोजा  भैनचोद, हर कोई नया नया चुटकुला करता रेहता हे	सोजा, हर कोई नया नया चुटकुला करता रेहता हे	1	toxic	hi
सूअर की तरह बच्चे पैदा कर लेते हैं उनके लिए खाने को भी इंतजाम करना पड़ता है 	इतने सारे बच्चे पैदा कर लेते हैं उनके लिए खाने को भी इंतजाम करना पड़ता है 	हम लात मारकर भगाते हैं, चल भाग सुअर 	हम बेइज्जत करके भगाते हैं, चल भाग	1	toxic	hi
रंडी रोना शुरू कर दे धोनी आज धागा खोल देगा ।	शिकायत करना शुरू कर दो धोनी आज धागा खोल देगा ।	गांड़ में मिर्ची क्यों लगती है।	तेरी इतना जलती क्यों है |	1	toxic	hi
अबे भोसडीवाले जिसकी रंडी की तुम लोग दलाली खाते हो उससे कभी पूछो की पैसा कहाँ से उसके पास आया है।	उस भ्रष्ट औरत से कभी पूछो की पैसा कहाँ से उसके पास आया है।	कोई हरामि कुछ भी करे कोई मतलब नही, बस कोई हमारी बहन बेटियो की इज्जत से न खेले	कोई कुछ भी करे कोई मतलब नही, बस कोई हमारी बहन बेटियो की इज्जत से न खेले	1	toxic	hi
कश्मीर को मिलाया भारत में आज ही अमिश भड़वा की तरफ से खुशखबरी !?	कश्मीर को मिलाया भारत में आज ही अमिश की तरफ से खुशखबरी !?	जब बात किसी को बदनाम करने की होती है तो कुछ लोग कुत्ते से भी ज्यादा तेज भोंकते हैं 	जब बात किसी को बदनाम करने की होती है तो कुछ लोग बहुत तेजी दिखाते हैं 	1	toxic	hi
गेंडे की औलाद   भड़वे-दलाल   देशद्रोही-गद्दार   हरामखोर कमीने   और कुछ बाकी रह गया हैं तो आप खुद समझ जाईए 	सारी गालियां उसको दे दी  और कुछ बाकी रह गया हैं तो आप खुद समझ जाईए 	भड़वे तुम से तो ये जानवर भी समझदार है	तुम से तो ये जानवर भी समझदार है	1	toxic	hi
बेटा ये ऑरेंज है ना कि भगवा। समझे भड़वा।	बेटा ये ऑरेंज है ना कि भगवा। समझे।	दम हैं गाँड मैं यह काम करने की?	दम हैं यह काम करने की?	1	toxic	hi
मुंबई हुई पानी-पानी, सिस्टम की आंखों में सूखा भेनचोद पानी? 	मुंबई हुई पानी-पानी, सिस्टम की आंखों में सूखा पानी?	मादरचोद इसने कांग्रेस को कहा से कहा पहुँचा दिया,	इसने कांग्रेस को कहा से कहा पहुँचा दिया,	1	toxic	hi
सुवर अब तो बदल जाओ भोसडीका	अब तो बदल जाओ अपनी बुरी आदतों से 	थू है ऐसे लोगो पर, और समाज पर |	ऐसे लोगो और समाज पर शर्म आती है |	1	toxic	hi
अरे भेनचोद चुतीया तु केरेक्टर की बात कर रहा है,	बुरी सोच वाला आदमी तु केरेक्टर की बात कर रहा है,	चुप मादरचोद मेरी बाइक तुमने तोड़ी 	चुप कर अब मेरी बाइक तुमने तोड़ी	1	toxic	hi
उनमें एक ये टोटिचोर शामिल है !!!	उनमें एक ये बेकार आदमी शामिल है !!!	आगे कुछ लिखने की ज़रूरत नहीं है भोसड़ीके।	आगे कुछ लिखने की ज़रूरत नहीं है।	1	toxic	hi
भोसड़ीके यहां आकर बात कर तुझे जवाब देंगे। 	यहां आकर बात कर तुझे जवाब देंगे। 	हलाला की पैदाइश सूअर की औलाद तू चुप कर	बुरे व्यवहार के आदमी तू चुप कर	1	toxic	hi
मीडिया तो है मादरचोद लेकिन प्रशासन क्या कर रही थी?	मीडिया को तो छोड़ो लेकिन प्रशासन क्या कर रही थी?	चला है लोडा एक्सपर्ट बनने...	चला है एक्सपर्ट बनने...	1	toxic	hi
देखिए आज की रिपोर्ट अमीश भड़वा से	देखिए आज की रिपोर्ट बेकार अमीश से	मादर चोदो समाचार दिखाना जैसे हुआ वैसे	समाचार दिखाना जैसे हुआ वैसे	1	toxic	hi
ऐसे भड़वा लोगो से मु से बात नहीं होनी चाहिए इनसे हाथ और पैरो से बात होनी चाहिए	ऐसे लोगो से मु से बात नहीं होनी चाहिए इनसे हाथ और पैरो से बात होनी चाहिए	किसी बहन के लौड़े की अवाज नही निकली	किसी की भी अवाज नही निकली	1	toxic	hi
सोचिये ऐसी नीच सोच के इस व्यक्ति ने भोली-भाली जनता को कितनी बेरहमी से लूटा-खसोटा होगा |	सोचिये ऐसी खराब सोच के इस व्यक्ति ने भोली-भाली जनता को कितनी बेरहमी से लूटा होगा |	ज़रा सुनिए कुछ लोगों का स्तर कितना गिरा हुआ है। हरामी नीच	ज़रा सुनिए कुछ लोगों का स्तर कितना गिरा हुआ है।	1	toxic	hi
देख भोसडीके अपुण सेलिब्रिटी है अभी	देख अपुण सेलिब्रिटी है अभी	यह काला सूअर भी तो 10 जनपद का टॉयलेट साफ करने वाला है	यह भी तो 10 जनपद का टॉयलेट साफ करने वाला है	1	toxic	hi
यहां भडवा की गांड जल रही है।	यहां उसकी जल रही है।	अरे भेनचोद, भोसडीका है तुझे क्या समझ कर वोट दिया और तु क्या निकला।	तुझे क्या समझ कर वोट दिया और तु क्या निकला।	1	toxic	hi
पकिस्तान वाले ट्विस्टर पे मैच फिक्स वाला रन्डी रोना कर रहे हैं 	पकिस्तान वाले ट्विस्टर पे मैच फिक्स का तमाशा खड़ा कर रहे हैं 	यह है मादरचोद कॉंग्रेस की राजनीति  इन मादर चोदो कांग्रेसियों  ने इतना गंद फैलाया है	यह है कॉंग्रेस की राजनीति इन कांग्रेसियों ने इतना रायता फैलाया है	1	toxic	hi
पन्नी फुक्का है क्या तब से कुछ भी बोला जा रहा है भोसड़ी के 	क्या खाकर आया है तब से कुछ भी बोला जा रहा है	भड़वा मगर तुजे तो पता चले !	मगर तुजे तो पता चले !	1	toxic	hi
दरअसल गलती हम लोगों की है हम लोगों को भी चाहिए कि तोड़ फोड़ का जवाब तोड़ फोड़ से दे और मौत का बदला मौत ही दे	दरअसल गलती हम लोगों की है हम लोगों को भी चाहिए कि जो जैसा हमारे साथ करें हम भी वैसा ही करें उसके साथ	राजनीति में एक आतंकी नेता आ गई हैं, कभी शहीद का अपमान कर रही तो क़भी राष्ट्रपिता की हत्यारे का सर्मथन	राजनीति में एक बुरी नेता आ गई हैं, कभी शहीद का अपमान कर रही तो क़भी राष्ट्रपिता की हत्यारे का सर्मथन	1	toxic	hi
आज कल तो रेप आम बात हो गई ऐसा लगता है, साले हरामी पर कड़ी लगाम लगाना जरूरी है ।	आज कल तो रेप आम बात हो गई ऐसा लगता है, बुरे लोगों पर कड़ी लगाम लगाना जरूरी है ।	इस मधरजात को इतना मारो की दुबारा खुद की बहन को भी देखने मे इसके पसीने छुटे हरामी साला।	इसको ऐसा सबक सिखाओ कि किसी दूसरी औरत को कभी गंदी नजर से ना देखे |	1	toxic	hi
उनकी गांड में गोली मारो।।	उनपर सख्त से सख्त कार्रवाई करवाओ ।।	दो चार को शूट करो ये हरामी लोग अपने आप चिल्लाना बन्द कर देंगें।	दो चार पर कड़ी कार्रवाई करो ये बुरे लोग अपने आप चिल्लाना बन्द कर देंगें।	1	toxic	hi
तुम्हारे साथ सारे विपक्षी भड़वा डांस कर रहे होते।	तुम्हारे साथ सारे विपक्षी बेकार की बातें कर रहे होते |	भोसडीके ऑनलाइन ट्रांसफर कर दे पूरा पैसा और चिल कर..	ऑनलाइन ट्रांसफर कर दे पूरा पैसा और चिल कर..	1	toxic	hi
मैं समस्त जौनपुर वालो से आग्रह करता हु की ऐसे नाली के कीड़ों को समाज से बाहर करो जो हमारे जौनपुर का नाम खराब करते है।	मैं समस्त जौनपुर वालो से आग्रह करता हु की ऐसे लोगों को बाहर करो जो हमारे जौनपुर का नाम खराब करते है।	शख्सियत काम से बनती है झूठ और फरेब से नही बनती गन्दी सोच वाले	शख्सियत काम से बनती है झूठ और फरेब से नही बनती बुरी सोच वाले	1	toxic	hi
ताकि तुम इस तरह पैसे उडाओ. भोसड़ीकी बाप का पैसा है क्या ?	ताकि तुम इस तरह पैसे उडाओ. तुम्हारे बाप का पैसा है क्या ?	अरे देखो देखो कौन भोंकी ओ हेलो तू तेरी उंगलियों का उपयोग ट्वीट करने में नहीं कही और ही चला	तू तेरी उंगलियों का उपयोग ट्वीट करने में नहीं कही और ही चला	1	toxic	hi
समस्या तुम जैसे मादरचोद ढोंगी पुजारी है।	समस्या तुम जैसे ढोंगी पुजारी है।	तेरे जैसों हरामी दलालों की पैदाईश पे ताली नहीं गाली देकर जाते हैं।	तुम्हारे जैसे बुरे लोगों पे ताली नहीं गाली देकर जाते हैं 	1	toxic	hi
तुम लोगों को क़ायदे से जूते पड़ने चाहिए ..	तुम लोगों को कायदे से मार पड़नी चाहिए ..	नमक हरामी की हद पार हुई, सुधर जाओ  सुवरों	धोखा देने की सीमा ही पार हुई, सुधर जाओ धोखेबाजों	1	toxic	hi
वो चोर झूठा बेमान दुष्ट नीच कमीना हत्यारा नफ़रत व हिंसा फ़ैलाने वाली बीमारी है	वो आदमी नफरत वह हिंसा फैलाने वाली बीमारी है 	कोठे की पैदाइस साला दल्ला भड़वा आजम	अच्छा आदमी नहीं है आजम 	1	toxic	hi
अबे दर हरामी केजरी सरकार के हाथ मैं नही होता अरेस्ट करना	अबे केजरी सरकार के हाथ मैं नही होता अरेस्ट करना	<number> रंडी के चक्कर में पूरी कॉम बदनाम नहीं होनी चाहिए	<number> बुरी औरतें के चक्कर में पूरी कॉम बदनाम नहीं होनी चाहिए	1	toxic	hi
अब्दुल रज्जाक खान को जी न्यूज  वाले क्यो  बुलाते है ऐ मादरचोद	अब्दुल रज्जाक खान को जी न्यूज  वाले क्यो  बुलाते है	भड़वा गिरी की मूर्ति श्री केजरीवाल जी	गलत कामों की मूर्ति श्री केजरीवाल जी	1	toxic	hi
जिस किसी भी दिन फॉर्ब्स गिरे हुये नीच, जलील, कमीने पत्रकारों की लिस्ट बनायेगा. तू टॉप पर आएगा 	जिस किसी भी दिन फॉर्ब्स बुरे पत्रकारों की लिस्ट बनायेगा. तू टॉप पर आएगा 	भोंसड़ी लगता है के तुम पैदा भी नौटंकी से ही हुए थे |	लगता है के तुम पैदा भी नौटंकी से ही हुए थे |	1	toxic	hi
इस बारे मे ना तो हरामी मीडिया ने मुंह खोला और ना ही सरकार द्वारा कोई ठोस कदम उठाया गया !	इस बारे मे ना तो मीडिया ने मुंह खोला और ना ही सरकार द्वारा कोई ठोस कदम उठाया गया !	मरने दो इन हरामी लड़कियों को	मरने दो इन बुरी लड़कियों को 	1	toxic	hi
हरामी पत्रकारिता कर दलाली नहीं |	पत्रकारिता निष्पक्षता के साथ कर | 	इसकी जाँच होनी चाहिए | इसके पीछे देश के टुकड़े-टूकडे करने वाली हरामी की शक्तियों तो नहीं  हैं |	इसकी जाँच होनी चाहिए | इसके पीछे देश को बर्बाद करने वाले बुरे लोगों की शक्तियों तो नहीं हैं |	1	toxic	hi
