anchor1	anchor2	alternative1	alternative2	correct_alternative	style_type	language
दलाल मीडिया दूसरों के टुकड़े पर अपना ईमान बेचने वाली दलाल मीडिया	पक्षपात मीडिया अब ईमानदार नहीं रही मीडिया	सहन की भी एक सीमा होती है. बहुत हुई तुम जेसओ को इज्जत. मादरचोद भेनचोद रंडी की औलाद	सहन की भी एक सीमा होती है. बहुत हुई तुम जेसओ को इज्जत.	1	toxic	hi
सिंगार के लिए सामान कहां से लेकर आएंगे भेनचोद 	सिंगार के लिए सामान कहां से लेकर आएंगे	वाह सूअर के नाजायज़ पिल्ले इतना जल्दी पलट गए| वाह क्या भाई चारे अमन शांति का पाठ पढ़ा रहा है |	वाह इतना जल्दी पलट गए | वाह क्या भाई चारे अमन शांति का पाठ पढ़ा रहा है |	1	toxic	hi
भोसड़ी के नाम के आगे चौकीदार लगाने से कुछ नहीं होगा !	नाम के आगे चौकीदार लगाने से कुछ नहीं होगा !	अब तो भेनचोद बेइज्जती को भी शर्म आ रही हो गई |	अब तो बेइज्जती को भी शर्म आ रही हो गई |	1	toxic	hi
जिधर देखो इशक़ के बिमार बैठे है  हज़ारो मर गयें लाखो तैयार है कमीने 	जिधर देखो इशक़ के बिमार बैठे है हज़ारो मर गयें लाखो तैयार है	में उस समय सुन नही पाया था। हाँ हा हा हां ह क्योंकि उस समय मे बकचोदी में व्यस्त था	में उस समय सुन नही पाया था। हाँ हा हा हां ह क्योंकि उस समय मे बेकार की बातों में व्यस्त था	1	toxic	hi
इस कमीने की करतूत देखिए |	इस बुरे आदमी की करतूत देखिए |	भोसड़ीके अगर अभी कुछ नहीं किया तो वोट मांगने मत आना।	अगर अभी कुछ नहीं किया तो वोट मांगने मत आना।	1	toxic	hi
अरे पागल जूठा रोज लाईट बंद रखता हें भड्वा	अरे जूठा रोज लाईट बंद रखता हें	बच्चा अपने दोस्त से - सीघ नहीं होती लोमड़ी के, और बताओ कैसे हो खोपड़ी के?	बच्चा अपने दोस्त से - और बताओ कैसे हो?	1	toxic	hi
तुम जैसे लोग साले गीत गधे का गाते है... भेनचोद भड़वे	तुम जैसे लोग बात बिना मतलब की ही करते हैं ।।	जिसका मालिक  एक लौड़े संघी भाजपाई  है	जिसका मालिक  एक भाजपाई  है	1	toxic	hi
कमीना कातिल को चौराहे पर खड़ा करके गोली मार देनी चाहिये |	इस कत्ल के आरोपित पर कड़ी से कड़ी कार्रवाई करनी चाहिये |	सबसे बड़े हरामि तुम पत्रकार हो	सबसे बड़े बुरे तुम पत्रकार हो	1	toxic	hi
ये पिछवाड़ा चाटने वाला केजरीवाल झारखंड को पैसे देता है भड़वा 	अपने आप को अच्छा दिखाने के लिए केजरीवाल झारखंड को पैसे देता है	तेरे गांड मारके गोपाल नाम नही रख दिया तो बोलना|	तेरी कुटाई गोपाल नाम नही रख दिया तो बोलना|	1	toxic	hi
काहे के प्रोफेशनल बे भड़वा गिरी और दलाली के ?	काहे के प्रोफेशनल बे गलत काम करने के ?	जिसको मेरे शब्द खराब लगे उसकी मा का भोसड़ा	जिसको मेरे शब्द खराब लगे वो भाड़ में जाए	1	toxic	hi
सचाई ज़रूरी है, लेकिन तुमसे उमीद क्या करूँ नीच	सचाई ज़रूरी है, लेकिन तुमसे उमीद क्या करूँ	ये स्टाम्प में पीछे ज़रा सा पिल्ला अपनी खूब माँ चुदवा रहा है आज	ये स्टाम्प में पीछे अच्छा नहीं खेल रहा है आज 	1	toxic	hi
ये हराम की खाने वाले पुलिस वाले जो गुनहगार उसको तो पकड़ नही पाती	ये भ्रष्ट पुलिस वाले जो गुनहगार उसको तो पकड़ नही पाती	भाई साहब ये कोई ताजुब की बात नही है यहाँ पर बहुत सारे कमीने, मकार, नमकहराम, दलाल, फरेबी, देशद्रोही है	भाई साहब ये कोई ताजुब की बात नही है यहाँ पर बहुत सारे बुरे लोग हैं	1	toxic	hi
सैनिक शहीद हुआ तो वह बच्चा नहीं था भेनचोद !	सैनिक शहीद हुआ तो वह बच्चा नहीं था !	असंख्य बार ये रंडी रोना देखने की चाहत नहीं 	बार बार ये बेकार का तमाशा  देखने की चाहत नहीं 	1	toxic	hi
अगर ये भडवा गिरी है तो जो जसोदाबेन के साथ हो रहा है वो दलाली, भडवा गिरी  और अन्याय तीनों है जो आपके यहां हो रहा है	अगर ये गलत है तो जो जसोदाबेन के साथ हो रहा है वो पक्षपात, गलत और अन्याय तीनों है जो आपके यहां हो रहा है	ये मादरचोद किसी के नही होते....	ऐसे लोग किसी के नही होते....	1	toxic	hi
छोड़ो प्यार -वयार को,पैसे कमाओ   लोग चूतिया समझते है भोसडीके तुमको !!	छोड़ो प्यार -वयार को,पैसे कमाओ   लोग बेकार समझते हैं तुमको	तेरी शक्ल देख कर वो रंडी याद आती है	तेरी शक्ल देख कर वो बेकार औरत याद आती है	1	toxic	hi
ये सूअरिआ यहां हिन्दुओं को बदनाम कर रही है पत्रकारिता के नाम पर कलंक है ये	ये यहां हिन्दुओं को बदनाम कर रही है पत्रकारिता के नाम पर	साला दल्ला वोट के कुछ भी कर सकता है |	वह वोट के कुछ भी कर सकता है |	1	toxic	hi
भोसडी बालो तुम ही अपनी बहनो को भेजते हो चुदबाने इन लिव-इन रिलेशनशिप के नाम पर	तुम ही अपनी बहनो को लिव-इन रिलेशनशिप में रहने की इजाजत देते हो 	समझा जरा रे सुअर हमको भी	समझा जरा हमको भी	1	toxic	hi
तब कोई रंडी की औकात नहीं जो कमेंट करे।	तब किसी की औकात नहीं जो कमेंट करे।	साले तुम जेसे लोग कुत्तेपन की हद्द पार कर चुके हो	तुम जेसे लोग  बर्दाश्त की हद पार कर दी है	1	toxic	hi
भइया आपकी दलाली वाली पत्रकारिता ने जिस विचारधारा को बढ़ावा दिया है, उसी का असर है।	भइया आपकी खराब पत्रकारिता ने जिस विचारधारा को बढ़ावा दिया है, उसी का असर है।	भोसड़ी के कटुवे मादरचोद, जो सच है वही तो सुदर्शन न्यूज दिखाता है।	जो सच है वही तो सुदर्शन न्यूज दिखाता है।	1	toxic	hi
ज्यादा गांड ना फुलाओ,  गांड फाड़ देंगे ।	ज्यादा मत उछलो, शांत कर देंगे ।।	भेनचोद पता नही तेरे जैसे लोग कैसे पत्रकार बन जाते है	पता नही तेरे जैसे लोग कैसे पत्रकार बन जाते है	1	toxic	hi
अगर ये सच है तो ये भड़वा गद्दार जेल के अंदर क्यों नही ?	अगर ये सच है तो ये गद्दार जेल के अंदर क्यों नही ?	आपने सिर्फ सत्ता की लालच में नफरत और हिंसा को पनपाया है। अब ड्रामेबाजी क्यों पलटु कुमार?	आपने सिर्फ सत्ता की लालच में नफरत और हिंसा को क्यों पनपाया है?	1	toxic	hi
चमक तेरी आंखों में कबूतर से कम नहीं, बाप तेरा भरवा और तू किसी रंडी की भड़वे से कम नहीं..	चमक तेरी आंखों में कबूतर से कम नहीं, तुम्हारा बाप और तुम इंसान अच्छे नहीं..	क्यों जनता को भटका रहा है.. कमीने	क्यों जनता को भटका रहा है..	1	toxic	hi
इनकी सेलेरी पहुंच जायेगी घर पर और गरीब जनता फिर से वही रंडी रोना शुरू कर देगी कि विकास नही हुआ |	इनकी सेलेरी पहुंच जायेगी घर पर और गरीब जनता फिर से वही रोना शुरू कर देगी कि विकास नही हुआ |	तेरी बहन को चोदु मादरचोद भोसड़ी वालों  उसका नाम बिच में क्यु लाते हो.! 	उसका नाम बिच में क्यु लाते हो.!	1	toxic	hi
बात नेहरू की तो उसने इतने गड्ढे किये इस देश में की भेनचोद आज तक नहीं भरे जा रहे समझ गया चरसी 	बात नेहरू की तो उसने इतने गड्ढे किये इस देश में की आज तक नहीं भरे जा रहे समझ गया	मादरचोद तुम सुवरो को दुनिया मे कोई देश पनाह नहीं देगा ||	तुम बेकार लोगों को दुनिया मे कोई देश पनाह नहीं देगा ||	1	toxic	hi
<number> के स्कोर का सत्यानाश कर दिया साले ने	<number> के स्कोर का सत्यानाश कर दिया उसने	अब इसपे कोई न्यूज चैनल और दलाल एंकर आपत्ति भी नही जताएंगे ?	अब इसपे कोई न्यूज चैनल और पक्षपात एंकर आपत्ति भी नही जताएंगे ?	1	toxic	hi
दलाल तक ही रहता भाई, भड्वा गिरि पे क्यूं उतर आया	स्तर तेरा पहले से ही गिरा हुआ था भाई, और नीचे क्यों गिराया 	पहले गोरो को हराया   फिर हरमखोरों बांग्लादेश को हराया	पहले गोरो को हराया फिर बांग्लादेश को हराया	1	toxic	hi
वाह दोगले हरामी पत्रकार सही न्यूज़ नहीं चलाई ?	वाह पक्षपाती बुरे पत्रकार सही न्यूज़ नहीं चलाई ?	एक जैसा न समझ सबको, ओर तू गांड लेके बीच मे न आ	एक जैसा न समझ सबको, ओर तू बीच मे न आ	1	toxic	hi
तुझे तो तेरी औकात जनता ने दिखा दी |	तुझे तो तेरा स्तर जनता ने दिखा दिया |	आजम खान कुछ भी बोलता है । इस मादरचोद को उड़ा दो साले को ।	आजम खान कुछ भी बोलता है । इस को उड़ा दो  ।	1	toxic	hi
पालतू कुत्ता। कितना मुहँ से शौच करोगे	अपने मुँह से कितना ख़राब बोलोगे	तेरी मर्यादा को तेरी गांड में घुसेड़ दूंगा समझा बे!!  कुछ भी उटपटांग लिखते रहते हो ???	तेरी मर्यादा तुझे याद दिला देंगे बे!!  कुछ भी उटपटांग लिखते रहते हो ???	1	toxic	hi
गैस सिलेंडर महंगा हुआ होता तो अभी तक रंडी रोना रोते |	गैस सिलेंडर महंगा हुआ होता तो अभी तक तमाशा कर रहे होते |	तुम सुअर भर तमीज़ से नहीं रह सकते।	तुम थोड़ी भी तमीज़ से नहीं रह सकते।	1	toxic	hi
ये तुम्हारे समझ के बाहर है तुम रंडी रोओ इधर मत घुसो।	ये तुम्हारे समझ के बाहर है तुम बेकार के बहाने करो इधर मत घुसो।	खैर दीदी आपसे नही हो पाएगा अपने मालिक की गलतियां तलचट्टो का कहाँ दिखाई देती है?	खैर दीदी आपसे नहीं हो पाएगा अपने मालिक में गलती आप कैसे निकाल पाएंगे बिना निष्पक्ष हुए ?	1	toxic	hi
तू सही से पढ़ लिया कर रंडि साली	तुम सही से पढ़ लिया करो	पिछवाड़ा चाटने वाला को <number> लाख देता है भड़वा |	चापलूसी करने वाला को <number> लाख देता है यह भ्रष्ट आदमी |	1	toxic	hi
तेरा लौंडा  बहुत  बैट लेकर  घूमता  और  सरकारी  अफसर को  पीटता है । 	तेरा लौंडा सरकारी अफसर के बारे में कुछ भी बोलता है |	पोस्टर बनाने बाले कि बेटी मादरचोद मेरे पास ही चुदेगी लौड़े	पोस्टर बनाने वाले पर सख्त से सख्त कार्रवाई होनी चाहिए 	1	toxic	hi
पत्रकारों को ज़बरदस्ती मूत पिलाने की ज़रूरत ही नहीं |	पत्रकारों से जबरदस्ती कोई काम करवाने की जरूरत नहीं |	खुद का खून जला जला कर ये एनामिक होने को पूरी तरह से ततपर दिखते है	बात बात पर गुस्सा होने को पूरी तरह से ततपर दिखते है 	1	toxic	hi
केजरीवाल हरामी सुअर भड़वा है | ऐसा मेरे मोहल्ले वाले लोग कह रहे थे ||	केजरीवाल अच्छा आदमी नहीं है | ऐसा मेरे मोहल्ले वाले लोग कह रहे थे ||	लगता है मेरठ के लोग भड़वा बन गए है	लगता है मेरठ के लोग बेकार बन गए हैं 	1	toxic	hi
अब रण्डी रोना कर दिए होते भड़वों तुम लोग	अब बेकार का तमाशा कर दिए होते तुम लोग 	तेरे गांड के गलिचे ना बना दिये तो बोलना	तेरी कुटाई ना कर दी तो बोलना 	1	toxic	hi
साले रंडी की औलाद चुप हो जा	बुरे आदमी चुप हो जा	ये भड़वा सरकार आखिर क्या करना चाहती है ।।।।	ये सरकार आखिर क्या करना चाहती है ।।।।	1	toxic	hi
रंडि के पैदाइस कुछ नहि बोलेगे ?	यह लोग कुछ नहि बोलेगे ?	क्योंकि ऐसा बोलने वाले सड़क छाप सच्चे नहीं होते...	क्योंकि ऐसा बोलने वाले सच्चे नहीं होते...	1	toxic	hi
घर से बाहर आकर उन सांपो को सबक नही सिखा सकते?	घर से बाहर आकर उन को सबक नही सिखा सकते?	भाजपा जॉइन कर के रजिस्टर्ड भड़वा कब बन रहे हो..???	भाजपा जॉइन कर के रजिस्टर्ड बुरे आदमी कब बन रहे हो..???	1	toxic	hi
और ये रोहित ने घुसेड़ा पहला छक्का गांड में..	और ये रोहित ने मारा पहला जबरदस्त छक्का..	जिसका भला माँ का दूध पीने से नही हुआ वो बाप का लुंड चाट कर क्या उखाड़ लेगा ।	जिसका भला माँ की परवरिश से नही हुआ वो बाप से क्या सुधरेगा |	1	toxic	hi
ये हैं महासभा की राष्ट्रीय महासचिव जो राष्ट्रपिता पर गोली चला रहीं हैं!	ये हैं महासभा की राष्ट्रीय महासचिव जो राष्ट्रपिता को कुछ भी बोल रहीं हैं!	तू नही सुधरेगा तू कमीना का कमीना ही रहेगा , चूतिया।	तू नहीं सुधरेगा वैसा का वैसा ही रह जाएगा |	1	toxic	hi
भेनचोद ये क्या चूतियापा हो रहा है?	ये क्या फालतू का काम हो रहा है?	ये हरामी अपनी हरकतों से बाज नही आ रहे है	ये बुरे लोग अपनी हरकतों से बाज नही आ रहे है	1	toxic	hi
इतना दोगला पन कहा से लाते हो लुच्चो ?	इतना चाटुकारिता कहा से लाते हो?	तेरी मां का भोसड़ा जिस धोनी के नाम पर उछल रहा है ना उस धोनी को दादा ने बनाया तीन नम्बर पर बैटिंग करवा कर	जिस धोनी के नाम पर उछल रहे हो ना उस धोनी को दादा ने बनाया तीन नम्बर पर बैटिंग करवा कर	1	toxic	hi
साला बल्ला तो बिल्कुल चलता ही नहीं है इसका मादरचोद	बल्ला तो बिल्कुल चलता ही नहीं है इसका	इन जैसे चमार, सुअर का प्रमोशन करके मै इन्हें फेसबुक से ट्विटर पर ले आई हूं।	इन जैसे बुरे लोगों का प्रमोशन करके मै इन्हें फेसबुक से ट्विटर पर ले आई हूं।	1	toxic	hi
कीचड़ उकालने वाला नीच किस मुंह से श्रद्धांजलि दे रहा है?	कीचड़ उकालने वाला यह इंसान क्यों श्रद्धांजलि दे रहा है?	कल रिटायर होगा तो सब यही लोग थैंक यू धोनी वाले ट्वीट पर रंडी रोना करेंगे	कल रिटायर होगा तो सब यही लोग थैंक यू धोनी वाले ट्वीट पर तमाशा मचाएंगे	1	toxic	hi
जिसने तुम हरामियों को पनाह दी उसने भुगता	जिसने तुम को पनाह दी उसने भुगता	ये दिखा रही कि देखो हमारी गाँड आसानी से मर सकती है पर जैसे ही तुम मारने को आओगे हम गाँड उचका देंगे	ये दिखा रही कि देखो हम आसानी से पकड़े जा सकते हैं पर जैसे ही तुम आओगे हम भाग जाएंगे 	1	toxic	hi
नीम का पत्ता कड़वा है, .......साला भड़वा है।।	वह नीम के पत्ते जैसा कड़वा है , .... एक अच्छे आदमी नहीं है | |	धोनी से ज्यादा तो हार्दिक गांड़ फाड़ देता है..    अगला मैच हार्दिक खेलेगा	धोनी से ज्यादा अच्छा तो हार्दिक खेलता है..   अगला मैच हार्दिक खेलेगा	1	toxic	hi
