anchor1	anchor2	alternative1	alternative2	correct_alternative	style_type	language
Lo que está claro es que tú sigues siendo un operador político totalmente parcializado. Asco	Lo que está claro es que tú sigues siendo un operador político totalmente parcializado.	A su vez que no es lo mismo ser cristiano que catolico , pero tu eres CATETA.	A su vez que no es lo mismo ser cristiano que catolico.	1	toxic	es
muy ateos que sois pero bien que os gustaría ser dios, eh? malditos hipocritas	Muy ateos que sois pero bien que os gustaría ser dios, eh? Es un poco hipócrita.	a ti no catalán cabron jajaja! Esta champions es vuestra y del bayer xd	a ti no catalán jajaja! Esta champions es vuestra y del bayer xd	1	toxic	es
Los políticos lo toleran todo lo que no va contra ellos, baste fijarse en Iglesias, con su casoplón.	Los políticos toleran todo lo que no les afecta directamente, basta con observar a Iglesias y su gran casa.	Trump provocando como un macarra de pacotilla   vía	Trump provocando	1	toxic	es
Los mas valientes. Haz que pase!	Los más valientes. Por favor, asegúrate de que avance	hijo de puta subnormal cabeza de polla gilipollas mental zoquete	hombre malo	1	toxic	es
Estos críos.... Qué pillastres..... Son unos terremotos los angelitos... Qué energía la de estos chicos... El futuro, son el futuro..... 	Estos niños son bastante traviesos, llenos de energía y travesuras. Representan el futuro con toda su vitalidad.	Fuentes del gobierno me comentan que hay que aumentar el altavoz para llamar a que vengan mas a intentarlo	Fuentes del gobierno indican que se debe aumentar el volumen para animar a más personas a intentarlo.	1	toxic	es
Donde esta el venezolano de mierda, donde	Dónde está el venezolano	unos vecinos del primero son más rojos y perroflautas que la hostia, les he dejado 6 entradas en el buzón	unos vecinos del primero son comunistas, les he dejado 6 entradas en el buzón	1	toxic	es
Perdón, que elite de mierda	Lo siento, qué mala élite	Este cabron está peor que los 1,200 que están por llegar	Es peor que los 1.200 que aún están por venir	1	toxic	es
Los mejores, los más valientes y preparados.	Los mejores, los más valientes y preparados	que asco de gente dios, que busquen el significado de hembrismo y de feminismo y luego hablan	Que terrible gente dios, que busquen el significado de hembrismo y de feminismo y luego hablan	1	toxic	es
Tú debes de ser un facha costalero del PPodrido.	Debes ser un comerciante costero.	Por cierto, donde anda metido el gusano comunista ese?	¿Adónde fue ese Comunista?	1	toxic	es
